{
  "$schema": "https://json-schema.org/draft/2020-12/schema",
  "$id": "https://github.com/kawa/1mark/schemas/evidence.schema.json",
  "title": "Evidence bundle: observed facts and inferences kept separate",
  "type": "object",
  "additionalProperties": false,
  "required": [
    "schema_version",
    "evidence_id",
    "race_id",
    "observations",
    "inferences",
    "missing_data",
    "synthetic",
    "vocabulary_version"
  ],
  "properties": {
    "schema_version": {
      "const": "1.0.0"
    },
    "evidence_id": {
      "$ref": "_defs.schema.json#/$defs/id"
    },
    "race_id": {
      "$ref": "_defs.schema.json#/$defs/race_id"
    },
    "synthetic": {
      "type": "boolean"
    },
    "observations": {
      "type": "array",
      "items": {
        "type": "object",
        "additionalProperties": false,
        "required": [
          "id",
          "field",
          "value",
          "source_url",
          "observed_at",
          "phase",
          "raw_value"
        ],
        "properties": {
          "id": {
            "$ref": "_defs.schema.json#/$defs/id"
          },
          "field": {
            "$ref": "_defs.schema.json#/$defs/field_name"
          },
          "boat": {
            "$ref": "_defs.schema.json#/$defs/boat"
          },
          "value": {
            "type": [
              "string",
              "number",
              "boolean"
            ],
            "description": "Normalized value"
          },
          "source_url": {
            "type": "string",
            "format": "uri",
            "pattern": "^https?://"
          },
          "observed_at": {
            "$ref": "_defs.schema.json#/$defs/timestamp"
          },
          "phase": {
            "enum": [
              "pre_race",
              "post_race"
            ]
          },
          "raw_value": {
            "type": "string",
            "description": "Value exactly as published by the source; never rewritten"
          }
        }
      }
    },
    "inferences": {
      "type": "array",
      "items": {
        "type": "object",
        "additionalProperties": false,
        "required": [
          "id",
          "statement",
          "based_on"
        ],
        "properties": {
          "id": {
            "$ref": "_defs.schema.json#/$defs/id"
          },
          "statement": {
            "$ref": "_defs.schema.json#/$defs/text"
          },
          "based_on": {
            "type": "array",
            "minItems": 1,
            "items": {
              "$ref": "_defs.schema.json#/$defs/id"
            },
            "description": "Observation ids"
          }
        }
      }
    },
    "missing_data": {
      "type": "array",
      "items": {
        "type": "object",
        "additionalProperties": false,
        "required": [
          "field",
          "reason"
        ],
        "properties": {
          "field": {
            "$ref": "_defs.schema.json#/$defs/text"
          },
          "boat": {
            "$ref": "_defs.schema.json#/$defs/boat"
          },
          "reason": {
            "$ref": "_defs.schema.json#/$defs/text"
          }
        }
      }
    },
    "vocabulary_version": {
      "$ref": "_defs.schema.json#/$defs/semver"
    }
  }
}
