{
  "schema_version": "1.0.0",
  "vocabulary_version": "1.0.0",
  "evidence_id": "SYN-EV-2",
  "race_id": "20000101-01-01",
  "synthetic": true,
  "observations": [
    {
      "id": "e1",
      "field": "exhibition_time",
      "value": 6.95,
      "raw_value": "6.95",
      "source_url": "https://example.invalid/synthetic/e1",
      "observed_at": "2000-01-01T14:20:00+09:00",
      "phase": "pre_race",
      "boat": 1
    },
    {
      "id": "e2",
      "field": "exhibition_time",
      "value": 6.71,
      "raw_value": "6.71",
      "source_url": "https://example.invalid/synthetic/e2",
      "observed_at": "2000-01-01T14:20:00+09:00",
      "phase": "pre_race",
      "boat": 4
    },
    {
      "id": "e3",
      "field": "exhibition_st",
      "value": 0.18,
      "raw_value": "0.18",
      "source_url": "https://example.invalid/synthetic/e3",
      "observed_at": "2000-01-01T14:25:00+09:00",
      "phase": "pre_race",
      "boat": 1
    },
    {
      "id": "e4",
      "field": "entry_course",
      "value": 1,
      "raw_value": "1",
      "source_url": "https://example.invalid/synthetic/e4",
      "observed_at": "2000-01-01T14:30:00+09:00",
      "phase": "pre_race",
      "boat": 1
    },
    {
      "id": "e5",
      "field": "wind_direction",
      "value": "NNE",
      "raw_value": "NNE",
      "source_url": "https://example.invalid/synthetic/e5",
      "observed_at": "2000-01-01T14:30:00+09:00",
      "phase": "pre_race"
    },
    {
      "id": "e6",
      "field": "wave_height_cm",
      "value": 3,
      "raw_value": "3",
      "source_url": "https://example.invalid/synthetic/e6",
      "observed_at": "2000-01-01T14:30:00+09:00",
      "phase": "pre_race"
    }
  ],
  "inferences": [
    {
      "id": "ei1",
      "statement": "SYNTHETIC: boat 1 exhibition is slow; boat 4 looks faster",
      "based_on": [
        "e1",
        "e2"
      ]
    }
  ],
  "missing_data": []
}
